{
  "id": "Il_Lago",
  "name_key": "Il_Lago_name",
  "difficulty": "normal",
  "timer_behavior": "complete",
  "scenes": [
    {
      "id": "boathouse",
      "order": 1,
      "time_limit": 120,
      "transition_out": "fade"
    },
    {
      "id": "lake_pier",
      "order": 2,
      "time_limit": 120,
      "transition_out": "fade"
    },
    {
      "id": "fisherman_hut",
      "order": 3,
      "time_limit": 120,
      "transition_out": "fade"
    },
    {
      "id": "greenhouse",
      "order": 4,
      "time_limit": 120,
      "transition_out": "fade"
    }
  ]
}