{
  "id": "Il_Paese",
  "name_key": "Il_Paese_name",
  "difficulty": "normal",
  "timer_behavior": "complete",
  "scenes": [
    {
      "id": "antique_shop",
      "order": 1,
      "time_limit": 120,
      "transition_out": "fade"
    },
    {
      "id": "village_cafe",
      "order": 2,
      "time_limit": 120,
      "transition_out": "fade"
    },
    {
      "id": "old_pharmacy",
      "order": 3,
      "time_limit": 120,
      "transition_out": "fade"
    },
    {
      "id": "bookshop_backroom",
      "order": 4,
      "time_limit": 120,
      "transition_out": "fade"
    }
  ]
}