{
  "id": "L_Arrivo",
  "name_key": "L_Arrivo_name",
  "difficulty": "normal",
  "timer_behavior": "complete",
  "scenes": [
    {
      "id": "villa_entrance_hall",
      "order": 1,
      "time_limit": 120,
      "transition_out": "fade"
    },
    {
      "id": "villa_kitchen",
      "order": 2,
      "time_limit": 120,
      "transition_out": "fade"
    },
    {
      "id": "villa_study",
      "order": 3,
      "time_limit": 120,
      "transition_out": "fade"
    },
    {
      "id": "villa_attic",
      "order": 4,
      "time_limit": 120,
      "transition_out": "fade"
    }
  ]
}